{
  "config_hash": "0e48101f0c00f6da2bb23c2a99521d8fa3f2256ccb5ef6d455e993284cd4f1dd",
  "created_at": "2026-08-10T23:49:03Z",
  "dataset_lineage": [
    {
      "dataset_id": "magi_synth_v0.1",
      "license_status": "NULLXES_SYNTHETIC",
      "weight": 1.0
    }
  ],
  "document_count": 64,
  "packing": {
    "bin_file": "train-00000.bin",
    "document_boundaries_preserved": true,
    "eos_between_documents": true,
    "pad_policy": "none_windowed",
    "token_dtype": "int32"
  },
  "quality_summary": {
    "generator_id": "magi_synth_templates_v0.1",
    "windows": 41
  },
  "sequence_length": 128,
  "shard_hash": "48a3fae3c49380865e6ecd691b5d1cb20a5da9d402609bf7e5f04d72294243ee",
  "shard_id": "train-00000",
  "split": "train",
  "token_count": 5248,
  "tokenizer_hash": "b499ef113b1afb0835ff69657eda3af1664aa610108b704e5d12354946217a36",
  "tokenizer_id": "magi_t4_smoke_v0.1",
  "version": "v0.1"
}
